{
  "schema_version": "1.0.0",
  "pack_id": "crush-poker-situations-starter-v1",
  "title": "Crush Poker — Situations complètes",
  "description": "Pack de démonstration d'un trainer de mains à embranchements. Les notes postflop sont pédagogiques et doivent être validées par solver avant d'être affichées comme GTO exact.",
  "feedback_mode": "end_of_hand",
  "grading": {
    "excellent": {
      "score": 2,
      "meaning": "Action cible / optimale ou appartenant clairement au mix optimal."
    },
    "bon": {
      "score": 1,
      "meaning": "Action défendable, EV proche ou exploitable, mais pas la branche cible."
    },
    "mauvais": {
      "score": 0,
      "meaning": "Erreur claire ou action nettement dominée dans le scénario."
    }
  },
  "scenarios": [
    {
      "id": "S001",
      "title": "SB 15 BB — QJs, construire sans surjouer",
      "format": {
        "game": "Expresso Nitro",
        "players": 3,
        "buy_in_eur": 5
      },
      "tags": [
        "3max",
        "SB",
        "15bb",
        "open",
        "top-pair",
        "value-control"
      ],
      "difficulty": "intermediaire",
      "validation": {
        "basis": "Préflop aligné sur la range utilisateur connue; postflop coach-curated",
        "solver_verified": false,
        "source_note": "QJs à 15 BB SB après fold BTN: limp et raise 2.5x appartiennent au mix utilisateur; shove n'est pas la branche cible."
      },
      "start_node_id": "S001_PF",
      "nodes": [
        {
          "id": "S001_PF",
          "street": "preflop",
          "state": {
            "hero_position": "SB",
            "hero_hand": [
              "Qs",
              "Js"
            ],
            "pot_bb": 1.5,
            "effective_stack_bb": 15,
            "board": [],
            "villain_action": "BTN fold",
            "history": [
              "BTN fold"
            ]
          },
          "prompt": "BTN fold. Tu es SB 15 BB avec Q♠J♠. Que fais-tu ?",
          "options": [
            {
              "id": "fold",
              "label": "Fold",
              "action_type": "fold",
              "amount_bb": null,
              "grade": "mauvais",
              "score": 0,
              "is_optimal": false,
              "feedback": "Main trop forte pour abandonner dans ce spot.",
              "ev_loss_bb": null,
              "next_node_id": null,
              "transition": null,
              "terminal": {
                "reason": "hero_fold",
                "result_text": "Main terminée préflop."
              }
            },
            {
              "id": "limp",
              "label": "Limp",
              "action_type": "limp",
              "amount_bb": null,
              "grade": "excellent",
              "score": 2,
              "is_optimal": true,
              "feedback": "Le limp fait partie de la stratégie mixée et protège une range large.",
              "ev_loss_bb": null,
              "next_node_id": "S001_F_L",
              "transition": {
                "villain_response": "BB check",
                "next_card": "Qh 7c 3s",
                "note": null
              },
              "terminal": null
            },
            {
              "id": "raise25",
              "label": "Raise 2.5 BB",
              "action_type": "raise",
              "amount_bb": 2.5,
              "grade": "excellent",
              "score": 2,
              "is_optimal": true,
              "feedback": "Le raise 2.5x fait partie de la stratégie mixée et prend de la value/initiative.",
              "ev_loss_bb": null,
              "next_node_id": "S001_F_R",
              "transition": {
                "villain_response": "BB call",
                "next_card": "Qh 7c 3s",
                "note": null
              },
              "terminal": null
            },
            {
              "id": "shove",
              "label": "Shove 15 BB",
              "action_type": "shove",
              "amount_bb": null,
              "grade": "mauvais",
              "score": 0,
              "is_optimal": false,
              "feedback": "Tu brûles de la jouabilité et fais surtout continuer une range plus forte.",
              "ev_loss_bb": null,
              "next_node_id": null,
              "transition": null,
              "terminal": {
                "reason": "training_stop",
                "result_text": "Action notée; branche arrêtée dans ce pack de démo."
              }
            }
          ]
        },
        {
          "id": "S001_F_L",
          "street": "flop",
          "state": {
            "hero_position": "SB",
            "hero_hand": [
              "Qs",
              "Js"
            ],
            "pot_bb": 2.0,
            "effective_stack_bb": 14,
            "board": [
              "Qh",
              "7c",
              "3s"
            ],
            "villain_action": "BB check",
            "history": [
              "SB limp",
              "BB check",
              "Flop Qh 7c 3s",
              "BB check"
            ]
          },
          "prompt": "Pot limpé. BB check. Action ?",
          "options": [
            {
              "id": "check",
              "label": "Check",
              "action_type": "check",
              "amount_bb": null,
              "grade": "bon",
              "score": 1,
              "is_optimal": false,
              "feedback": "Contrôle possible, mais tu rates de la value contre beaucoup de moins bien.",
              "ev_loss_bb": null,
              "next_node_id": "S001_T_LC",
              "transition": {
                "villain_response": "BB check",
                "next_card": "9d",
                "note": null
              },
              "terminal": null
            },
            {
              "id": "bet1",
              "label": "Bet 1 BB",
              "action_type": "bet",
              "amount_bb": 1.0,
              "grade": "excellent",
              "score": 2,
              "is_optimal": true,
              "feedback": "Petit bet très efficace sur board sec: value large et coût faible.",
              "ev_loss_bb": null,
              "next_node_id": "S001_T_LB",
              "transition": {
                "villain_response": "BB call",
                "next_card": "9d",
                "note": null
              },
              "terminal": null
            },
            {
              "id": "bet2",
              "label": "Bet 2 BB",
              "action_type": "bet",
              "amount_bb": 2.0,
              "grade": "bon",
              "score": 1,
              "is_optimal": false,
              "feedback": "Value possible mais sizing plus polarisant que nécessaire.",
              "ev_loss_bb": null,
              "next_node_id": "S001_T_LB",
              "transition": {
                "villain_response": "BB call",
                "next_card": "9d",
                "note": null
              },
              "terminal": null
            },
            {
              "id": "shove",
              "label": "Shove",
              "action_type": "shove",
              "amount_bb": null,
              "grade": "mauvais",
              "score": 0,
              "is_optimal": false,
              "feedback": "Surprotection massive: tu fais folder trop de moins bien.",
              "ev_loss_bb": null,
              "next_node_id": null,
              "transition": null,
              "terminal": {
                "reason": "overplay",
                "result_text": "Main terminée."
              }
            }
          ]
        },
        {
          "id": "S001_T_LC",
          "street": "turn",
          "state": {
            "hero_position": "SB",
            "hero_hand": [
              "Qs",
              "Js"
            ],
            "pot_bb": 2.0,
            "effective_stack_bb": 14,
            "board": [
              "Qh",
              "7c",
              "3s",
              "9d"
            ],
            "villain_action": "BB check",
            "history": [
              "Flop check/check",
              "Turn 9d",
              "BB check"
            ]
          },
          "prompt": "Après check flop, BB check encore turn. Action ?",
          "options": [
            {
              "id": "bet1",
              "label": "Bet 1 BB",
              "action_type": "bet",
              "amount_bb": 1.0,
              "grade": "excellent",
              "score": 2,
              "is_optimal": true,
              "feedback": "Value/protection claire après double check adverse.",
              "ev_loss_bb": null,
              "next_node_id": "S001_R",
              "transition": {
                "villain_response": "BB call puis bet 2.5 BB river",
                "next_card": "4c",
                "note": null
              },
              "terminal": null
            },
            {
              "id": "check",
              "label": "Check",
              "action_type": "check",
              "amount_bb": null,
              "grade": "bon",
              "score": 1,
              "is_optimal": false,
              "feedback": "Possible, mais tu laisses de la value sur table.",
              "ev_loss_bb": null,
              "next_node_id": "S001_R",
              "transition": {
                "villain_response": "BB bet 2.5 BB river",
                "next_card": "4c",
                "note": null
              },
              "terminal": null
            },
            {
              "id": "shove",
              "label": "Shove",
              "action_type": "shove",
              "amount_bb": null,
              "grade": "mauvais",
              "score": 0,
              "is_optimal": false,
              "feedback": "Sizing disproportionné avec une main de value moyenne.",
              "ev_loss_bb": null,
              "next_node_id": null,
              "transition": null,
              "terminal": {
                "reason": "overplay",